<?xml version="1.0" encoding="UTF-8"?>
<lunch xmlns:xsi="http://www.w3.org/2001/XMLSchema-instance"
 xsi:schemaLocation="urn:mini mini-schema.xsd" xmlns="urn:mini">
    <sandwich><p>Ham and cheese</p></sandwich>
    <chip>malt vinegar</chip>
    <chip>malt vinegar</chip>
    <chip>malt vinegar</chip>
    <cookie days="Sun Mon Tue" baker="jean">chocolate chip</cookie>
    <cookie days="Sun Mon Tue" baker="jean">oatmeal</cookie>
    <cookie days="Sun Mon Tue" baker="jean">snickerdoodle</cookie>
</lunch>