<?xml version="1.0" encoding="UTF-8"?>
<lunch xmlns:xsi="http://www.w3.org/2001/XMLSchema-instance"
 xsi:schemaLocation="urn:mini mini-schema.xsd" xmlns="urn:mini">
    <sandwich id="wap"><p>Ham and cheese</p>
      <p>hold the mustard</p>
    </sandwich>
    <sandwich id="cap"><p>Mayonnaise</p></sandwich>
    <chip brand="nabisco">malt vinegar</chip>
    <chip>malt vinegar</chip>
    <chip brand="sunshine">malt vinegar</chip>
    <cookie days="Sun Mon Tue" baker="jean">chocolate chip</cookie>
    <cookie days="Sun Mon Tue" baker="jean">oatmeal</cookie>
    <cookie days="Sun Mon Tue" baker="jean">snickerdoodle</cookie>
</lunch>